smartctl 7.0 2018-12-30 r4883 [x86_64-linux-3.10.0-1062.el7.x86_64] (local build)
Copyright (C) 2002-18, Bruce Allen, Christian Franke, www.smartmontools.org

=== START OF INFORMATION SECTION ===
Device Model:     TOSHIBA MG06ACA10TE
Serial Number:    48H0A027FLEF
LU WWN Device Id: 5 000039 898c8d845
Firmware Version: 4303
User Capacity:    10,000,831,348,736 bytes [10.0 TB]
Sector Sizes:     512 bytes logical, 4096 bytes physical
Rotation Rate:    7200 rpm
Form Factor:      3.5 inches
Device is:        Not in smartctl database [for details use: -P showall]
ATA Version is:   ACS-3 T13/2161-D revision 5
SATA Version is:  SATA 3.3, 6.0 Gb/s (current: 6.0 Gb/s)
Local Time is:    Tue Jan 26 09:38:47 2021 CST
SMART support is: Available - device has SMART capability.
SMART support is: Enabled

=== START OF READ SMART DATA SECTION ===
SMART overall-health self-assessment test result: PASSED

General SMART Values:
Offline data collection status:  (0x80)	Offline data collection activity
					was never started.
					Auto Offline Data Collection: Enabled.
Self-test execution status:      (   0)	The previous self-test routine completed
					without error or no self-test has ever 
					been run.
Total time to complete Offline 
data collection: 		(  120) seconds.
Offline data collection
capabilities: 			 (0x5b) SMART execute Offline immediate.
					Auto Offline data collection on/off support.
					Suspend Offline collection upon new
					command.
					Offline surface scan supported.
					Self-test supported.
					No Conveyance Self-test supported.
					Selective Self-test supported.
SMART capabilities:            (0x0003)	Saves SMART data before entering
					power-saving mode.
					Supports SMART auto save timer.
Error logging capability:        (0x01)	Error logging supported.
					General Purpose Logging supported.
Short self-test routine 
recommended polling time: 	 (   2) minutes.
Extended self-test routine
recommended polling time: 	 (1061) minutes.
SCT capabilities: 	       (0x003d)	SCT Status supported.
					SCT Error Recovery Control supported.
					SCT Feature Control supported.
					SCT Data Table supported.

SMART Attributes Data Structure revision number: 16
Vendor Specific SMART Attributes with Thresholds:
ID# ATTRIBUTE_NAME          FLAG     VALUE WORST THRESH TYPE      UPDATED  WHEN_FAILED RAW_VALUE
  1 Raw_Read_Error_Rate     0x000b   100   100   050    Pre-fail  Always       -       0
  2 Throughput_Performance  0x0005   100   100   050    Pre-fail  Offline      -       0
  3 Spin_Up_Time            0x0027   100   100   001    Pre-fail  Always       -       9436
  4 Start_Stop_Count        0x0032   100   100   000    Old_age   Always       -       1
  5 Reallocated_Sector_Ct   0x0033   100   100   010    Pre-fail  Always       -       0
  7 Seek_Error_Rate         0x000b   100   100   050    Pre-fail  Always       -       0
  8 Seek_Time_Performance   0x0005   100   100   050    Pre-fail  Offline      -       0
  9 Power_On_Hours          0x0032   100   100   000    Old_age   Always       -       13
 10 Spin_Retry_Count        0x0033   100   100   030    Pre-fail  Always       -       0
 12 Power_Cycle_Count       0x0032   100   100   000    Old_age   Always       -       1
191 G-Sense_Error_Rate      0x0032   100   100   000    Old_age   Always       -       0
192 Power-Off_Retract_Count 0x0032   100   100   000    Old_age   Always       -       0
193 Load_Cycle_Count        0x0032   100   100   000    Old_age   Always       -       2
194 Temperature_Celsius     0x0022   100   100   000    Old_age   Always       -       25 (Min/Max 21/27)
196 Reallocated_Event_Count 0x0032   100   100   000    Old_age   Always       -       0
197 Current_Pending_Sector  0x0032   100   100   000    Old_age   Always       -       0
198 Offline_Uncorrectable   0x0030   100   100   000    Old_age   Offline      -       0
199 UDMA_CRC_Error_Count    0x0032   200   200   000    Old_age   Always       -       0
220 Disk_Shift              0x0002   100   100   000    Old_age   Always       -       17563653
222 Loaded_Hours            0x0032   100   100   000    Old_age   Always       -       4
223 Load_Retry_Count        0x0032   100   100   000    Old_age   Always       -       0
224 Load_Friction           0x0022   100   100   000    Old_age   Always       -       0
226 Load-in_Time            0x0026   100   100   000    Old_age   Always       -       529
240 Head_Flying_Hours       0x0001   100   100   001    Pre-fail  Offline      -       0

SMART Error Log Version: 1
No Errors Logged

SMART Self-test log structure revision number 1
No self-tests have been logged.  [To run self-tests, use: smartctl -t]

SMART Selective self-test log data structure revision number 1
 SPAN  MIN_LBA  MAX_LBA  CURRENT_TEST_STATUS
    1        0        0  Not_testing
    2        0        0  Not_testing
    3        0        0  Not_testing
    4        0        0  Not_testing
    5        0        0  Not_testing
Selective self-test flags (0x0):
  After scanning selected spans, do NOT read-scan remainder of disk.
If Selective self-test is pending on power-up, resume after 0 minute delay.

smartctl 7.0 2018-12-30 r4883 [x86_64-linux-3.10.0-1062.el7.x86_64] (local build)
Copyright (C) 2002-18, Bruce Allen, Christian Franke, www.smartmontools.org

=== START OF INFORMATION SECTION ===
Model Family:     Samsung based SSDs
Device Model:     SAMSUNG MZ7LM480HMHQ-00005
Serial Number:    S2UJNX0H800654
LU WWN Device Id: 5 002538 c403b28ff
Firmware Version: GXT5104Q
User Capacity:    480,103,981,056 bytes [480 GB]
Sector Size:      512 bytes logical/physical
Rotation Rate:    Solid State Device
Form Factor:      2.5 inches
Device is:        In smartctl database [for details use: -P show]
ATA Version is:   ACS-2, ATA8-ACS T13/1699-D revision 4c
SATA Version is:  SATA 3.1, 6.0 Gb/s (current: 6.0 Gb/s)
Local Time is:    Tue Jan 26 09:39:24 2021 CST
SMART support is: Available - device has SMART capability.
SMART support is: Enabled

=== START OF READ SMART DATA SECTION ===
SMART overall-health self-assessment test result: PASSED

General SMART Values:
Offline data collection status:  (0x02)	Offline data collection activity
					was completed without error.
					Auto Offline Data Collection: Disabled.
Self-test execution status:      (   0)	The previous self-test routine completed
					without error or no self-test has ever 
					been run.
Total time to complete Offline 
data collection: 		( 2100) seconds.
Offline data collection
capabilities: 			 (0x53) SMART execute Offline immediate.
					Auto Offline data collection on/off support.
					Suspend Offline collection upon new
					command.
					No Offline surface scan supported.
					Self-test supported.
					No Conveyance Self-test supported.
					Selective Self-test supported.
SMART capabilities:            (0x0003)	Saves SMART data before entering
					power-saving mode.
					Supports SMART auto save timer.
Error logging capability:        (0x01)	Error logging supported.
					General Purpose Logging supported.
Short self-test routine 
recommended polling time: 	 (   2) minutes.
Extended self-test routine
recommended polling time: 	 (  35) minutes.
SCT capabilities: 	       (0x003d)	SCT Status supported.
					SCT Error Recovery Control supported.
					SCT Feature Control supported.
					SCT Data Table supported.

SMART Attributes Data Structure revision number: 1
Vendor Specific SMART Attributes with Thresholds:
ID# ATTRIBUTE_NAME          FLAG     VALUE WORST THRESH TYPE      UPDATED  WHEN_FAILED RAW_VALUE
  5 Reallocated_Sector_Ct   0x0033   100   100   010    Pre-fail  Always       -       0
  9 Power_On_Hours          0x0032   098   098   000    Old_age   Always       -       7669
 12 Power_Cycle_Count       0x0032   099   099   000    Old_age   Always       -       184
177 Wear_Leveling_Count     0x0013   099   099   005    Pre-fail  Always       -       30
179 Used_Rsvd_Blk_Cnt_Tot   0x0013   100   100   010    Pre-fail  Always       -       0
180 Unused_Rsvd_Blk_Cnt_Tot 0x0013   100   100   010    Pre-fail  Always       -       1602
181 Program_Fail_Cnt_Total  0x0032   100   100   010    Old_age   Always       -       0
182 Erase_Fail_Count_Total  0x0032   100   100   010    Old_age   Always       -       0
183 Runtime_Bad_Block       0x0013   100   100   010    Pre-fail  Always       -       0
184 End-to-End_Error        0x0033   100   100   097    Pre-fail  Always       -       0
187 Uncorrectable_Error_Cnt 0x0032   100   100   000    Old_age   Always       -       0
190 Airflow_Temperature_Cel 0x0032   073   052   000    Old_age   Always       -       27
194 Temperature_Celsius     0x0022   073   052   000    Old_age   Always       -       27 (Min/Max 19/84)
195 ECC_Error_Rate          0x001a   200   200   000    Old_age   Always       -       0
197 Current_Pending_Sector  0x0032   100   100   000    Old_age   Always       -       0
199 CRC_Error_Count         0x003e   066   066   000    Old_age   Always       -       34302
202 Exception_Mode_Status   0x0033   100   100   010    Pre-fail  Always       -       0
235 POR_Recovery_Count      0x0012   099   099   000    Old_age   Always       -       135
241 Total_LBAs_Written      0x0032   099   099   000    Old_age   Always       -       14913877630
242 Total_LBAs_Read         0x0032   099   099   000    Old_age   Always       -       13212701087
243 SATA_Downshift_Ct       0x0032   100   100   000    Old_age   Always       -       0
244 Thermal_Throttle_St     0x0032   100   100   000    Old_age   Always       -       0
245 Timed_Workld_Media_Wear 0x0032   100   100   000    Old_age   Always       -       65535
246 Timed_Workld_RdWr_Ratio 0x0032   100   100   000    Old_age   Always       -       65535
247 Timed_Workld_Timer      0x0032   100   100   000    Old_age   Always       -       65535
251 NAND_Writes             0x0032   100   100   000    Old_age   Always       -       43230746624

SMART Error Log Version: 1
No Errors Logged

SMART Self-test log structure revision number 1
No self-tests have been logged.  [To run self-tests, use: smartctl -t]

SMART Selective self-test log data structure revision number 1
 SPAN  MIN_LBA  MAX_LBA  CURRENT_TEST_STATUS
    1        0        0  Not_testing
    2        0        0  Not_testing
    3        0        0  Not_testing
    4        0        0  Not_testing
    5        0        0  Not_testing
  255        0    65535  Read_scanning was completed without error
Selective self-test flags (0x0):
  After scanning selected spans, do NOT read-scan remainder of disk.
If Selective self-test is pending on power-up, resume after 0 minute delay.

smartctl 7.0 2018-12-30 r4883 [x86_64-linux-3.10.0-1062.el7.x86_64] (local build)
Copyright (C) 2002-18, Bruce Allen, Christian Franke, www.smartmontools.org

=== START OF INFORMATION SECTION ===
Device Model:     SSDSC2BB800G7N       00PH261      LENOVO
Serial Number:    PHDV624400D2800IGN
LU WWN Device Id: 5 5cd2e4 04c7bce88
Firmware Version: N201LT33
User Capacity:    800,166,076,416 bytes [800 GB]
Sector Sizes:     512 bytes logical, 4096 bytes physical
Rotation Rate:    Solid State Device
Form Factor:      2.5 inches
Device is:        Not in smartctl database [for details use: -P showall]
ATA Version is:   ACS-3 T13/2161-D revision 5
SATA Version is:  SATA 3.1, 6.0 Gb/s (current: 6.0 Gb/s)
Local Time is:    Tue Jan 26 09:39:24 2021 CST
SMART support is: Available - device has SMART capability.
SMART support is: Enabled

=== START OF READ SMART DATA SECTION ===
SMART overall-health self-assessment test result: PASSED

General SMART Values:
Offline data collection status:  (0x00)	Offline data collection activity
					was never started.
					Auto Offline Data Collection: Disabled.
Self-test execution status:      (   0)	The previous self-test routine completed
					without error or no self-test has ever 
					been run.
Total time to complete Offline 
data collection: 		(    0) seconds.
Offline data collection
capabilities: 			 (0x79) SMART execute Offline immediate.
					No Auto Offline data collection support.
					Suspend Offline collection upon new
					command.
					Offline surface scan supported.
					Self-test supported.
					Conveyance Self-test supported.
					Selective Self-test supported.
SMART capabilities:            (0x0003)	Saves SMART data before entering
					power-saving mode.
					Supports SMART auto save timer.
Error logging capability:        (0x01)	Error logging supported.
					General Purpose Logging supported.
Short self-test routine 
recommended polling time: 	 (   1) minutes.
Extended self-test routine
recommended polling time: 	 (   2) minutes.
Conveyance self-test routine
recommended polling time: 	 (   2) minutes.
SCT capabilities: 	       (0x003d)	SCT Status supported.
					SCT Error Recovery Control supported.
					SCT Feature Control supported.
					SCT Data Table supported.

SMART Attributes Data Structure revision number: 1
Vendor Specific SMART Attributes with Thresholds:
ID# ATTRIBUTE_NAME          FLAG     VALUE WORST THRESH TYPE      UPDATED  WHEN_FAILED RAW_VALUE
  1 Raw_Read_Error_Rate     0x000f   130   130   039    Pre-fail  Always       -       16899
  5 Reallocated_Sector_Ct   0x0033   100   100   001    Pre-fail  Always       -       1
  9 Power_On_Hours          0x0032   100   100   000    Old_age   Always       -       3937
 12 Power_Cycle_Count       0x0032   100   100   000    Old_age   Always       -       237
 13 Read_Soft_Error_Rate    0x001e   130   130   000    Old_age   Always       -       4294984195
100 Unknown_Attribute       0x0032   100   100   000    Old_age   Always       -       127685
170 Unknown_Attribute       0x0033   099   099   010    Pre-fail  Always       -       17104
171 Unknown_Attribute       0x0032   100   100   000    Old_age   Always       -       0
172 Unknown_Attribute       0x0032   100   100   000    Old_age   Always       -       0
173 Unknown_Attribute       0x0032   098   098   000    Old_age   Always       -       515404857425
174 Unknown_Attribute       0x0032   100   100   000    Old_age   Always       -       198
177 Wear_Leveling_Count     0x0032   061   061   000    Old_age   Always       -       515404857425
184 End-to-End_Error        0x0033   100   100   090    Pre-fail  Always       -       0
187 Reported_Uncorrect      0x0032   100   100   000    Old_age   Always       -       0
188 Command_Timeout         0x0032   100   100   000    Old_age   Always       -       344946
190 Airflow_Temperature_Cel 0x0026   078   075   029    Old_age   Always       -       22 (Min/Max 18/40)
192 Power-Off_Retract_Count 0x0032   100   100   000    Old_age   Always       -       198
194 Temperature_Celsius     0x0022   100   100   000    Old_age   Always       -       22
195 Hardware_ECC_Recovered  0x001a   100   100   000    Old_age   Always       -       237
196 Reallocated_Event_Count 0x0033   099   099   010    Pre-fail  Always       -       1
197 Current_Pending_Sector  0x0012   100   100   000    Old_age   Always       -       0
198 Offline_Uncorrectable   0x0010   100   100   000    Old_age   Offline      -       0
199 UDMA_CRC_Error_Count    0x003e   100   100   000    Old_age   Always       -       865320
231 Temperature_Celsius     0x0033   098   098   001    Pre-fail  Always       -       0
232 Available_Reservd_Space 0x0033   099   099   010    Pre-fail  Always       -       17104
233 Media_Wearout_Indicator 0x0032   098   098   000    Old_age   Always       -       0
235 Unknown_Attribute       0x0033   100   100   010    Pre-fail  Always       -       1606369688326
237 Unknown_Attribute       0x0032   100   100   000    Old_age   Always       -       1606369688326
241 Total_LBAs_Written      0x0032   100   100   000    Old_age   Always       -       2822068
242 Total_LBAs_Read         0x0032   100   100   000    Old_age   Always       -       3342790

SMART Error Log Version: 1
No Errors Logged

SMART Self-test log structure revision number 1
No self-tests have been logged.  [To run self-tests, use: smartctl -t]

SMART Selective self-test log data structure revision number 1
 SPAN  MIN_LBA  MAX_LBA  CURRENT_TEST_STATUS
    1        0        0  Not_testing
    2        0        0  Not_testing
    3        0        0  Not_testing
    4        0        0  Not_testing
    5        0        0  Not_testing
Selective self-test flags (0x0):
  After scanning selected spans, do NOT read-scan remainder of disk.
If Selective self-test is pending on power-up, resume after 0 minute delay.

smartctl 7.0 2018-12-30 r4883 [x86_64-linux-3.10.0-1062.el7.x86_64] (local build)
Copyright (C) 2002-18, Bruce Allen, Christian Franke, www.smartmontools.org

=== START OF INFORMATION SECTION ===
Model Family:     Intel 730 and DC S35x0/3610/3700 Series SSDs
Device Model:     INTEL SSDSC2BB800G7
Serial Number:    PHDV6236001W800CGN
LU WWN Device Id: 5 5cd2e4 04c7b2776
Firmware Version: N2010112
User Capacity:    800,166,076,416 bytes [800 GB]
Sector Sizes:     512 bytes logical, 4096 bytes physical
Rotation Rate:    Solid State Device
Form Factor:      2.5 inches
Device is:        In smartctl database [for details use: -P show]
ATA Version is:   ACS-3 T13/2161-D revision 5
SATA Version is:  SATA 3.1, 6.0 Gb/s (current: 6.0 Gb/s)
Local Time is:    Tue Jan 26 09:39:24 2021 CST
SMART support is: Available - device has SMART capability.
SMART support is: Enabled

=== START OF READ SMART DATA SECTION ===
SMART overall-health self-assessment test result: PASSED

General SMART Values:
Offline data collection status:  (0x02)	Offline data collection activity
					was completed without error.
					Auto Offline Data Collection: Disabled.
Self-test execution status:      (   0)	The previous self-test routine completed
					without error or no self-test has ever 
					been run.
Total time to complete Offline 
data collection: 		(    2) seconds.
Offline data collection
capabilities: 			 (0x79) SMART execute Offline immediate.
					No Auto Offline data collection support.
					Suspend Offline collection upon new
					command.
					Offline surface scan supported.
					Self-test supported.
					Conveyance Self-test supported.
					Selective Self-test supported.
SMART capabilities:            (0x0003)	Saves SMART data before entering
					power-saving mode.
					Supports SMART auto save timer.
Error logging capability:        (0x01)	Error logging supported.
					General Purpose Logging supported.
Short self-test routine 
recommended polling time: 	 (   1) minutes.
Extended self-test routine
recommended polling time: 	 (   2) minutes.
Conveyance self-test routine
recommended polling time: 	 (   2) minutes.
SCT capabilities: 	       (0x003d)	SCT Status supported.
					SCT Error Recovery Control supported.
					SCT Feature Control supported.
					SCT Data Table supported.

SMART Attributes Data Structure revision number: 1
Vendor Specific SMART Attributes with Thresholds:
ID# ATTRIBUTE_NAME          FLAG     VALUE WORST THRESH TYPE      UPDATED  WHEN_FAILED RAW_VALUE
  5 Reallocated_Sector_Ct   0x0032   099   099   000    Old_age   Always       -       16
  9 Power_On_Hours          0x0032   100   100   000    Old_age   Always       -       8613
 12 Power_Cycle_Count       0x0032   100   100   000    Old_age   Always       -       1406
170 Available_Reservd_Space 0x0033   099   099   010    Pre-fail  Always       -       0
171 Program_Fail_Count      0x0032   100   100   000    Old_age   Always       -       4
172 Erase_Fail_Count        0x0032   100   100   000    Old_age   Always       -       0
174 Unsafe_Shutdown_Count   0x0032   100   100   000    Old_age   Always       -       1218
175 Power_Loss_Cap_Test     0x0033   100   100   010    Pre-fail  Always       -       15550 (1717 872)
183 SATA_Downshift_Count    0x0032   100   100   000    Old_age   Always       -       0
184 End-to-End_Error        0x0033   100   100   090    Pre-fail  Always       -       0
187 Reported_Uncorrect      0x0032   100   100   000    Old_age   Always       -       0
190 Temperature_Case        0x0022   078   077   000    Old_age   Always       -       22 (Min/Max 17/24)
192 Unsafe_Shutdown_Count   0x0032   100   100   000    Old_age   Always       -       1218
194 Temperature_Internal    0x0022   100   100   000    Old_age   Always       -       22
197 Current_Pending_Sector  0x0012   100   100   000    Old_age   Always       -       0
199 CRC_Error_Count         0x003e   100   100   000    Old_age   Always       -       33098
225 Host_Writes_32MiB       0x0032   100   100   000    Old_age   Always       -       1367359
226 Workld_Media_Wear_Indic 0x0032   100   100   000    Old_age   Always       -       102400
227 Workld_Host_Reads_Perc  0x0032   100   100   000    Old_age   Always       -       0
228 Workload_Minutes        0x0032   100   100   000    Old_age   Always       -       4170301990
232 Available_Reservd_Space 0x0033   099   099   010    Pre-fail  Always       -       0
233 Media_Wearout_Indicator 0x0032   099   099   000    Old_age   Always       -       0
234 Thermal_Throttle        0x0032   100   100   000    Old_age   Always       -       0/0
241 Host_Writes_32MiB       0x0032   100   100   000    Old_age   Always       -       1367359
242 Host_Reads_32MiB        0x0032   100   100   000    Old_age   Always       -       748943
243 NAND_Writes_32MiB       0x0032   100   100   000    Old_age   Always       -       2363681

SMART Error Log Version: 1
No Errors Logged

SMART Self-test log structure revision number 1
Num  Test_Description    Status                  Remaining  LifeTime(hours)  LBA_of_first_error
# 1  Short offline       Completed without error       00%       667         -

SMART Selective self-test log data structure revision number 1
 SPAN  MIN_LBA  MAX_LBA  CURRENT_TEST_STATUS
    1        0        0  Not_testing
    2        0        0  Not_testing
    3        0        0  Not_testing
    4        0        0  Not_testing
    5        0        0  Not_testing
Selective self-test flags (0x0):
  After scanning selected spans, do NOT read-scan remainder of disk.
If Selective self-test is pending on power-up, resume after 0 minute delay.

smartctl 7.0 2018-12-30 r4883 [x86_64-linux-3.10.0-1062.el7.x86_64] (local build)
Copyright (C) 2002-18, Bruce Allen, Christian Franke, www.smartmontools.org

=== START OF INFORMATION SECTION ===
Device Model:     TOSHIBA MG06ACA10TE
Serial Number:    48H0A027FLEF
LU WWN Device Id: 5 000039 898c8d845
Firmware Version: 4303
User Capacity:    10,000,831,348,736 bytes [10.0 TB]
Sector Sizes:     512 bytes logical, 4096 bytes physical
Rotation Rate:    7200 rpm
Form Factor:      3.5 inches
Device is:        Not in smartctl database [for details use: -P showall]
ATA Version is:   ACS-3 T13/2161-D revision 5
SATA Version is:  SATA 3.3, 6.0 Gb/s (current: 6.0 Gb/s)
Local Time is:    Tue Jan 26 09:39:24 2021 CST
SMART support is: Available - device has SMART capability.
SMART support is: Enabled

=== START OF READ SMART DATA SECTION ===
SMART overall-health self-assessment test result: PASSED

General SMART Values:
Offline data collection status:  (0x80)	Offline data collection activity
					was never started.
					Auto Offline Data Collection: Enabled.
Self-test execution status:      (   0)	The previous self-test routine completed
					without error or no self-test has ever 
					been run.
Total time to complete Offline 
data collection: 		(  120) seconds.
Offline data collection
capabilities: 			 (0x5b) SMART execute Offline immediate.
					Auto Offline data collection on/off support.
					Suspend Offline collection upon new
					command.
					Offline surface scan supported.
					Self-test supported.
					No Conveyance Self-test supported.
					Selective Self-test supported.
SMART capabilities:            (0x0003)	Saves SMART data before entering
					power-saving mode.
					Supports SMART auto save timer.
Error logging capability:        (0x01)	Error logging supported.
					General Purpose Logging supported.
Short self-test routine 
recommended polling time: 	 (   2) minutes.
Extended self-test routine
recommended polling time: 	 (1061) minutes.
SCT capabilities: 	       (0x003d)	SCT Status supported.
					SCT Error Recovery Control supported.
					SCT Feature Control supported.
					SCT Data Table supported.

SMART Attributes Data Structure revision number: 16
Vendor Specific SMART Attributes with Thresholds:
ID# ATTRIBUTE_NAME          FLAG     VALUE WORST THRESH TYPE      UPDATED  WHEN_FAILED RAW_VALUE
  1 Raw_Read_Error_Rate     0x000b   100   100   050    Pre-fail  Always       -       0
  2 Throughput_Performance  0x0005   100   100   050    Pre-fail  Offline      -       0
  3 Spin_Up_Time            0x0027   100   100   001    Pre-fail  Always       -       9436
  4 Start_Stop_Count        0x0032   100   100   000    Old_age   Always       -       1
  5 Reallocated_Sector_Ct   0x0033   100   100   010    Pre-fail  Always       -       0
  7 Seek_Error_Rate         0x000b   100   100   050    Pre-fail  Always       -       0
  8 Seek_Time_Performance   0x0005   100   100   050    Pre-fail  Offline      -       0
  9 Power_On_Hours          0x0032   100   100   000    Old_age   Always       -       13
 10 Spin_Retry_Count        0x0033   100   100   030    Pre-fail  Always       -       0
 12 Power_Cycle_Count       0x0032   100   100   000    Old_age   Always       -       1
191 G-Sense_Error_Rate      0x0032   100   100   000    Old_age   Always       -       0
192 Power-Off_Retract_Count 0x0032   100   100   000    Old_age   Always       -       0
193 Load_Cycle_Count        0x0032   100   100   000    Old_age   Always       -       2
194 Temperature_Celsius     0x0022   100   100   000    Old_age   Always       -       25 (Min/Max 21/27)
196 Reallocated_Event_Count 0x0032   100   100   000    Old_age   Always       -       0
197 Current_Pending_Sector  0x0032   100   100   000    Old_age   Always       -       0
198 Offline_Uncorrectable   0x0030   100   100   000    Old_age   Offline      -       0
199 UDMA_CRC_Error_Count    0x0032   200   200   000    Old_age   Always       -       0
220 Disk_Shift              0x0002   100   100   000    Old_age   Always       -       17563653
222 Loaded_Hours            0x0032   100   100   000    Old_age   Always       -       4
223 Load_Retry_Count        0x0032   100   100   000    Old_age   Always       -       0
224 Load_Friction           0x0022   100   100   000    Old_age   Always       -       0
226 Load-in_Time            0x0026   100   100   000    Old_age   Always       -       529
240 Head_Flying_Hours       0x0001   100   100   001    Pre-fail  Offline      -       0

SMART Error Log Version: 1
No Errors Logged

SMART Self-test log structure revision number 1
No self-tests have been logged.  [To run self-tests, use: smartctl -t]

SMART Selective self-test log data structure revision number 1
 SPAN  MIN_LBA  MAX_LBA  CURRENT_TEST_STATUS
    1        0        0  Not_testing
    2        0        0  Not_testing
    3        0        0  Not_testing
    4        0        0  Not_testing
    5        0        0  Not_testing
Selective self-test flags (0x0):
  After scanning selected spans, do NOT read-scan remainder of disk.
If Selective self-test is pending on power-up, resume after 0 minute delay.

